{
	"id": "uri:507f1f77bcf86cd799439011",
	"license": "https://opendatacommons.org/licenses/pddl/1.0/",
	"copyrightHolder": "Company A",
	"provenance": {
		"narrative": "This information was collected by a UAV",
		"creators": [
			{
				"name": "Robin Gandhi",
				"email": "test@test.com"
			}
		]
	},
	"classification": [
		"Restricted Data"
	],
	"sharingRestrictions": [
		"Intellectual Property",
		"License Required"
	]
}
